Question,Option_1,Option_2,Option_3,Option_4,Explanation,Type,File,Country,Category,Wikipedia,Answer_Type,False_type
Which Oxford college was both founded in the 15th century and also hosted regular meetings of a group of experimental scientists that later went on to establish the Royal Society?,I don't know,Wadham College,University College,Balliol Colleg,"Wadham College, founded in 1610, 15th century, hosted the regular meetings under the guidance of the college's Warden, John Wilkins, and the group formed the nucleus that went on to found the Royal Society.",Intersection,6_University_of_Oxford,United_Kingdom,Education,https://en.wikipedia.org/wiki/University_of_Oxford,Location,Property
What was the subject area that University located at 42°22′28″N 71°07′01″W introduced first in the 16th century?,I don't know,Philosophy,Mathematics,Law,"Harvard University did not introduce any new subject areas in the 17th century, as it was founded in 1636 and focused on training Puritan ministers during that time. Accordingly, it did not exist in the 16th century.",Geographical,7_Harvard_University,United_States,Education,https://en.wikipedia.org/wiki/Harvard_University,Common_noun,Property
Which former French emperor approved the implementation of the French national academic qualification that students can obtain at the completion of their secondary education in 1908?,Charles de Gaulle,I don't know,Louis XIV,Napoleon Bonaparte,"The baccalauréat was implemented in 1808, not 1908, by Napoleon Bonaparte. The question has a false premise about the year of implementation.",Named,2_baccalauréat,France,Education,https://en.wikipedia.org/wiki/baccalauréat,Person,Event
"What was the primary language used by students at the University of Paris who were part of the ""Normandy-German"" nation?",English,German,I don't know,Frence,"University of Paris divided students into four nationes according to language or regional origin: France, Normandy, Picardy, and England. The last came to be known as the Alemannian (German) nation. Accordingly, there was not ""Normandy-German"" option.",Named,6_University_of_Paris,France,Education,https://en.wikipedia.org/wiki/University_of_Paris,Language_or_Nationality_or_Country,Event
"In which year did the Chinese Gymnast who was referred to as ""The Yellow Beast"" went to study at the University of Wisconsin-Madison?",2008,2011,2010,I don't know,Zhang Yining was not Gymanst. She was a Table Tennis player and studied at the University of Wisconsin-Madison in 2011.,Named,10_Zhang_Yining,China,Sports,https://en.wikipedia.org/wiki/Zhang_Yining,Date_or_Time_Period,Event
Which Italian athlete won a gold medal at the second time that European Athletics Championships was held in Italy (at the Stadio Olimpico) in Field?,Assunta Legnante,I don't know,Pietro Mennea,Jury Chechi,"Pietro Mennea won the gold medal in Track not in Field in 1974, which was the second time that that European Athletics Championships was held.",Temporal,12_Stadio_Olimpico,Italy,Sports,https://en.wikipedia.org/wiki/Stadio_Olimpico,Person,Scope
In which year did Mo Farah win both the Olympics gold medal and the World Gold medal?,I don't know,2013,2012,2016,"Farah won the world gold medal in 2011, 2013, 2015, and 2017, while he won the Olympics gold medal in 2012 and 2016.",Intersection,6_Mo_Farah,United_Kingdom,Sports,https://en.wikipedia.org/wiki/Mo_Farah,Date_or_Time_Period,Event
"How many oscars did the ""Master of Suspense"" win?",3,5,1,I don't know,"Alfred Hitchcock, the Master of Suspense, did not win any Oscars.",Named,1_Cinema_of_the_United_Kingdom,United_Kingdom,Entertainment,https://en.wikipedia.org/wiki/Cinema_of_the_United_Kingdom,Number,Event
In which country both early color films were also pioneered and was the first to use cars on roads?,France,Germany,UK,I don't know,"While the UK was early in adopting cars, other countries, like France, also saw early automobile use, and the first automobile was invented in Germany.",Intersection,1_Cinema_of_the_United_Kingdom,United_Kingdom,Entertainment,https://en.wikipedia.org/wiki/Cinema_of_the_United_Kingdom,Language_or_Nationality_or_Country,Event
How many years after the start of the World War II did Alfred Hitchcock direct the first British 'talkie'?,I don't know,7,2,10,"World War II started on 1 September 1939. Blackmail (1929) was the first British ""talkie"". Accordingly, it was not after WW II.",Temporal,2_Alfred_Hitchcock,United_Kingdom,Entertainment,https://en.wikipedia.org/wiki/Alfred_Hitchcock,Number,Event
In what year did the the oldest large-scale film studio in the world take over Universum Film AG (UFA)?,1917,I don't know,1925,1922,"Babelsberg Studio, the oldest large-scale film studio in the world, was incorporated into UFA and became the largest film studio in Europe.",Named,1_German_cinema,Germany,Entertainment,https://en.wikipedia.org/wiki/German_cinema,Date_or_Time_Period,Event
Which German filmmaker both directed the documentary that was awarded the Alfred P. Sloan Prize and starred in the film Nosferatu the Vampyre in 1979?,Werner Herzog,Rainer Werner Fassbinder,I don't know,Wim Wenders,"While Werner Herzog directed Grizzly Man, he did not star in Nosferatu the Vampyre, which was directed by him but starred Klaus Kinski.",Intersection,2_Werner_Herzog,Germany,Entertainment,https://en.wikipedia.org/wiki/Werner_Herzog,Person,Event
"Which Chinese director directed both the opening and closing ceremonies of the 2008 Beijing Summer Olympics and the 2022 Beijing Winter Olympics, and also received an honorary doctorate from Yale University in the 1990s?",I don't know,Chen Kaige,Zhang Yimou,Tian Zhuangzhuang,"Zhang Yimou received an honorary doctorate from Yale University in 2010, not the 1990s.",Intersection,2_Zhang_Yimou,China,Entertainment,https://en.wikipedia.org/wiki/Zhang_Yimou,Person,Event
What was the nationality of the person from Northern Europe who introduced European music to China by presenting a harpsichord to the Ming imperial court?,English,I don't know,Portuguese,Irish,"Matteo Ricci, who was an Italian, presented a Harpsichord to the Ming imperial court. He was not from Northern Europe.",Named,6_Music_of_China,China,Entertainment,https://en.wikipedia.org/wiki/Music_of_China,Language_or_Nationality_or_Country,Event
Which remake of The Intouchables was our sooner?,Italian,Chinese,German,I don't know,"There are only Indian, Spanish, and English remakes of the Intouchables.",Comparison,3_The_Intouchables,France,Entertainment,https://en.wikipedia.org/wiki/The_Intouchables,Language_or_Nationality_or_Country,Event
In which year did Steven Spielbergh directed his first film using a $100 budget?,I don't know,1965,1971,1964,"While Spielberg did create an early short film with minimal resources, his first film, ""Firelight"", had a $500 budget.",Named,2_Steven_Spielberg,United_States,Entertainment,https://en.wikipedia.org/wiki/Steven_Spielberg,Date_or_Time_Period,Entity
Which British horticulturist both cultivated watercress commercially and introduced it to China in the 1800s?,I don't know,Charles Darwin,Gregor Mendel,William Bradbery,The document does not mention that watercress was introduced to China by a British horticulturist. It states that watercress was introduced to China through Hong Kong and Macao in the 1800s from Europe.,Comparison,6_Watercress,United_Kingdom,Food,https://en.wikipedia.org/wiki/Watercress,Person,Event
Which French chef both used caraway seeds in a traditional French cheese and incorporated caraway into a classic French liqueur in the 18th century?,Georges Auguste Escoffier,I don't know,Auguste Escoffier,Marie-Antoine Carême,There is no evidence that any French chef in the 18th century used caraway seeds in a traditional French cheese or incorporated caraway into a classic French liqueur. Caraway is not a common ingredient in traditional French cuisine or liqueurs.,Comparison,8_Caraway,France,Food,https://en.wikipedia.org/wiki/Caraway,Person,Event
Which German baker invented the pretzel shape and the lye washing technique to give pretzels their distinctive flavor in the 12th century?,Johann Pretzelbäcker,Franz Bretzelius,Siegfried Kringel,I don't know,"The pretzel shape and lye washing technique existed before the 12th century, and there is no single inventor credited with these innovations.",Intersection,5_Pretzel,Germany,Food,https://en.wikipedia.org/wiki/Pretzel,Person,Entity
Which German city was the first to export mustard seeds to North America and establish a thriving mustard production industry in the 19th century?,I don't know,Frankfurt,Hamburg,Munich,"While Germany has been a major producer and exporter of mustard seeds, there is no evidence of a specific German city establishing a thriving mustard production industry in North America in the 19th century. Mustard production in North America developed independently, often using seeds from other regions.",Intersection,7_Mustard_seed,Germany,Food,https://en.wikipedia.org/wiki/Mustard_seed,Location,Event
What spice used in traditional Fesenjan was first imported to Iran during the Safavid dynasty's rule?,Cinnamon,Saffron,I don't know,Cardamom,"The facts do not mention any spices being introduced to Iran during the Safavid dynasty's rule. The spices used in Fesenjan, such as cinnamon and cardamom, are common Persian ingredients.",Temporal,3_Fesenjan,Iran,Food,https://en.wikipedia.org/wiki/Fesenjan,Food_Drink,Event
Which Iranian chef both invented Doogh and introduced it to the Safavid court in the 16th century?,Alireza Mohammadi,Karim Nasiri,I don't know,Mohammad Reza Shams,"Doogh is an ancient Iranian drink that predates the Safavid period, and there is no evidence of a specific Iranian chef inventing it.",Intersection,11_Doogh,Iran,Food,https://en.wikipedia.org/wiki/Doogh,Person,Property
"Which summer drink, made of honey and vinegar, was both popular in ancient Persia and seasoned with cinnamon in the 15th century?",I don't know,Sekanjabin,Faloodeh,Sharbat,"Sekanjabin is not seasoned with cinnamon, and its history predates the 15th century.",Intersection,15_Sekanjabin,Iran,Food,https://en.wikipedia.org/wiki/Sekanjabin,Food_Drink,Event
Which type of basil was used by the Michelin-starred Italian chef who created the first basil-infused gelato served in the Amalfi Coast region?,Genovese Basil,Purple Basil,Thai Basil,I don't know,There is no record of a Michelin-starred Italian chef creating the first basil-infused gelato in the Amalfi Coast region. Gelato recipes do not typically use basil as a primary ingredient.,Named,6_Basil,Italy,Food,https://en.wikipedia.org/wiki/Basil,Food_Drink,Entity
"Which Italian chef, known for incorporating Porcini in their signature dishes, also cultivated the mushroom commercially in the 1800s?",Marco Polo,Pellegrino Artusi,Massimo Bottura,I don't know,"The document states that Porcini are very difficult to cultivate commercially, so no Italian chef would have been able to cultivate them in the 1800s.",Intersection,10_Porcini,Italy,Food,https://en.wikipedia.org/wiki/Porcini,Person,Property
"Which ethnic group in China, the Bai or the Dai people, first adopted Vajrayana Buddhism during the Tang Dynasty?",Bai,I don't know,Dai,Both Bai and Dai,"The false premise here is that a specific ethnic group in China first adopted Vajrayana Buddhism during the Tang Dynasty. In reality, Vajrayana Buddhism flourished in China during the Tang Dynasty, but it was not explicitly adopted by the Bai or Dai people. The document mentions Azhaliism, a Vajrayana Buddhist religion, as being practiced among the Bai people, but does not specify when this tradition was first adopted.",Comparison,2_Chinese_folk_religion,China,Religion,https://en.wikipedia.org/wiki/Chinese_folk_religion,Group_or_Org,Event
Which Taoist deity inspired the creation of the ancient Talijin pagoda and was later worshipped in the temple built on its site in the 12th century?,Caishen,Zhong Kui,Pangu,I don't know,"The Talijin pagoda is not an ancient structure, and there is no evidence that it was inspired by a Taoist deity. The temple built on its site in the 12th century also did not worship a specific Taoist deity.",Intersection,2_Chinese_folk_religion,China,Religion,https://en.wikipedia.org/wiki/Chinese_folk_religion,Person,Event
Which German philosopher both authored the 95 Theses that sparked the Protestant Reformation and established the Jesuit order to lead the Counter-Reformation in the 16th century?,Martin Luther,Ignatius of Loyola,I don't know,Gottfried Wilhelm Leibniz,"The 95 Theses were written by Martin Luther, not a philosopher, and the Jesuit order was founded by Ignatius of Loyola, not Luther.",Intersection,1_Christianity_in_Germany,Germany,Religion,https://en.wikipedia.org/wiki/Christianity_in_Germany,Person,Event
Which Islamic scholar both founded the Islamic Institute Ma'ahad-ul-Islam in 1927 and later led the Caliphate State organization that was banned in 2002 for being unconstitutional?,I don't know,Haj Amin al-Husseini,Said Nursi,Cemalettin Kaplan,"The false premise in this question is that the Islamic Institute Ma'ahad-ul-Islam (later known as Zentralinstitut Islam-Archiv-Deutschland) and the Caliphate State organization were founded and led by the same person. In reality, the Islamic Institute was founded in 1927, while the Caliphate State was founded by Cemalettin Kaplan and later led by his son Metin Kaplan, and this organization was banned in 2002.",Intersection,4_Islam_in_Germany,Germany,Religion,https://en.wikipedia.org/wiki/Islam_in_Germany,Person,Event
Which Iranian scientist in the 9th century translated the Quran into Persian and also introduced new Islamic practices to promote conversion among Zoroastrians?,Rhazes,Al-Khwarizmi,I don't know,Avicenna,"There is no evidence that any Iranian scientist in the 9th century translated the Quran into Persian or introduced new Islamic practices specifically to promote conversion among Zoroastrians. The first complete translation of the Quran into Persian occurred during the Samanid dynasty in the 9th century, but the translator is not named in the facts provided.",Intersection,1_Islam_in_Iran,Iran,Religion,https://en.wikipedia.org/wiki/Islam_in_Iran,Person,Event
Which Italian pope commissioned the construction of St. Peter's Basilica and also introduced Baroque architecture to the Sistine Chapel in the 17th century?,Pope Clement VII,I don't know,Pope Urban VIII,Pope Alexander VII,"The Sistine Chapel was decorated with Michelangelo's frescoes in the 16th century, before the introduction of Baroque architecture. No pope commissioned the construction of St. Peter's Basilica, as it was an ongoing project over centuries.",Intersection,1_Catholicism_in_Italy,Italy,Religion,https://en.wikipedia.org/wiki/Catholicism_in_Italy,Person,Event
Which Italian rabbi both wrote the renowned Talmudic lexicon 'Aruk' and had a Jewish physician named Isaac ben Mordecai as their personal doctor in the 13th century?,Isaiah di Trani the Elder,I don't know,Shabbethai ben Moses,Nathan ben Jehiel,The facts do not mention any Italian rabbi having a Jewish physician as their personal doctor in the 13th century.,Intersection,5_Judaism_in_Italy,Italy,Religion,https://en.wikipedia.org/wiki/Judaism_in_Italy,Person,Event
Which Italian archbishop declared All Saints' Day to be celebrated on November 1st and also encouraged the observance of All Souls' Day on November 2nd?,Pope Sixtus IV,Pope Gregory IV,Pope Boniface IV,I don't know,"The document does not mention any Italian archbishop declaring All Saints' Day to be celebrated on November 1st or encouraging the observance of All Souls' Day. It states that Pope Gregory IV extended the observance of All Saints' Day to the whole Catholic Church in the 9th century, and that Pope Sixtus IV added the All Saints octave in the 15th century.",Intersection,4_All_Saints__Day,Italy,Holidays_Celebrations_Leisure,https://en.wikipedia.org/wiki/All_Saints__Day,Person,Event
What was the official name of the military parade held in Paris on the special day of 14 July before it was moved to the Champs-Élysées in 1918?,Parade de l'Étoile,Parade de la Concorde,I don't know,Parade des Tuileries,"The question assumes there was an official military parade held in Paris on Bastille Day before it was moved to the Champs-Élysées in 1918, which is not true according to the facts provided. The Bastille Day military parade has been held on the Champs-Élysées since 1918.",Geographical,1_Bastille_Day,France,Holidays_Celebrations_Leisure,https://en.wikipedia.org/wiki/Bastille_Day,Event,Event
Which popular French musician both composed the official theme song for the Fête de la Musique and conducted a free public performance on the day in 1983?,Serge Gainsbourg,Claude Debussy,Édith Piaf,I don't know,"The Fête de la Musique did not have an official theme song, and no specific musician is known to have conducted a free public performance on the day in 1983. The event is focused on promoting amateur and public musical performances rather than featuring professional musicians.",Intersection,9_Fête_de_la_Musique,France,Holidays_Celebrations_Leisure,https://en.wikipedia.org/wiki/Fête_de_la_Musique,Person,Event
"In which city did Martin Luther deliver his famous 1520 treatise ""On the Babylonian Captivity of the Church"" during the centenary celebrations of the Protestant Christian religious holiday on 31 October?",Berlin,Munich,I don't know,Wittenberg,"Martin Luther did not deliver any treatises during the centenary celebrations of the Reformation in 1617, as he had died over 100 years earlier.",Temporal,3_Reformation_Day,Germany,Holidays_Celebrations_Leisure,https://en.wikipedia.org/wiki/Reformation_Day,Location,Event
Which Protestant German ruler first made Reformation Day an official nationwide holiday and also prescribed detailed worship services and sermons for the 100th anniversary celebration in 1617?,John George I of Saxony,I don't know,Martin Luther,John George II of Saxony,"Reformation Day was not an official nationwide holiday in Germany until much later, and the 100th anniversary celebration in 1617 was more focused on Lutheran orthodoxy than being prescribed by a ruler.",Intersection,3_Reformation_Day,Germany,Holidays_Celebrations_Leisure,https://en.wikipedia.org/wiki/Reformation_Day,Person,Event
Which German car manufacturer sponsored the world's largest Volksfest parade in 2005?,BMW,Volkswagen,Mercedes-Benz,I don't know,"There is no evidence that any German car manufacturer has sponsored the Oktoberfest parade. The Oktoberfest parade is a traditional event featuring local Bavarian marching bands, costume groups, and breweries, not corporate sponsors.",Named,6_Oktoberfest,Germany,Holidays_Celebrations_Leisure,https://en.wikipedia.org/wiki/Oktoberfest,Group_or_Org,Event
What was the nationality of the Olympic athlete who lit the cauldron at the opening ceremony of the the world's largest Volksfest festival in Munich in 1980?,I don't know,German,American,Russian,"The Oktoberfest festival does not have an opening ceremony with an Olympic athlete lighting a cauldron. This is a false premise. Oktoberfest is an annual beer festival and carnival held in Munich, Bavaria, and does not involve an Olympic-style opening ceremony.",Named,6_Oktoberfest,Germany,Holidays_Celebrations_Leisure,https://en.wikipedia.org/wiki/Oktoberfest,Language_or_Nationality_or_Country,Event
Which Iranian artist both designed the iconic Nasir al-Mulk Mosque and incorporated traditional Persian tile motifs in its facade in the 17th century?,Ostad Ahmad Mimar,I don't know,Seyyed Mohammad Hossein Habibi,Mohammad-Reza Shirazi,"The Nasir al-Mulk Mosque was not designed in the 17th century, but rather in the late 19th century. Additionally, the mosque's facade features stained glass windows, not traditional Persian tile motifs.",Intersection,5_Eid_al-Fitr,Iran,Holidays_Celebrations_Leisure,https://en.wikipedia.org/wiki/Eid_al-Fitr,Person,Event
Which Italian politician both presided over the National Liberation Committee of Upper Italy in 1945 and later became the first President of the Italian Republic?,I don't know,Luigi Longo,Rodolfo Morandi,Alfredo Pizzoni,"The National Liberation Committee of Upper Italy was a wartime organization, and none of its members went on to become the first President of the Italian Republic. The first President was actually Enrico De Nicola, who was not a member of the National Liberation Committee.",Intersection,2_Liberation_Day_(Italy),Italy,Holidays_Celebrations_Leisure,https://en.wikipedia.org/wiki/Liberation_Day_(Italy),Person,Event
Which Iranian leader both established the Islamic Republic and led the protests that overthrew the Pahlavi dynasty in 1989?,Ayatollah Khomeini,I don't know,Mohammad Reza Pahlavi,Reza Pahlavi,1989 is long after revolution in Iran.,Intersection,3_Anniversary_of_the_Iranian_revolution,Iran,Holidays_Celebrations_Leisure,https://en.wikipedia.org/wiki/Anniversary_of_the_Iranian_revolution,Person,Property
Which Native American tribe both taught the Pilgrims agricultural techniques and joined them for a feast in 1621 that is considered the first Thanksgiving?,Patuxet,Narragansett,Wampanoag,I don't know,"The Patuxet tribe did not join the Pilgrims for the 1621 harvest feast, as they had been wiped out by an epidemic prior to the Pilgrims' arrival. The Wampanoag, led by Massasoit, did interact with and assist the Pilgrims, but it was not a joint feast.",Intersection,2_Thanksgiving_(United_States),United_States,Holidays_Celebrations_Leisure,https://en.wikipedia.org/wiki/Thanksgiving_(United_States),Group_or_Org,Event
How old was Jennifer Doudna when her family moved to the city where she later attended high school and completed her PhD?,3,18,I don't know,7,"She did not do the both acts in the same city. She recieved her PhD from Harvard, while attended Hilo High School.",Geographical,1_Jennifer_Doudna,United_States,Science_and_technology,https://en.wikipedia.org/wiki/Jennifer_Doudna,Number,Entity
"Which scientist both discovered CRISPR-Cas9, was awarded the Nobel Prize in Chemistry, and won the Priestley Medal?",Yoshizumi Ishino,I don't know,Jennifer Doudna,Emmanuelle Charpentier,"Emmanuelle Charpentier and Jennifer Doudna satisfy the first two conditions, but not the third one.",Intersection,1_Jennifer_Doudna,United_States,Science_and_technology,https://en.wikipedia.org/wiki/Jennifer_Doudna,Person,Property
Which Italian company was both ranked between the 100th to 110th on both the Fortune Global 500 and the Fortune Global 2000 in 2022?,I don't know,Assicurazioni Generali,Eni S.p.A.,Enel,"Eni ranked 111th, not between the 100th to 110th, on both the Fortune Global 500 and the Fortune Global 2000 in 2022.",Intersection,11_Eni_S.p.A,Italy,Science_and_technology,https://en.wikipedia.org/wiki/Eni_S.p.A,Group_or_Org,Entity
"When did the English theoretical physicist, cosmologist, and author who died on 14 March 2018 (aged 74) win the Nobel Prize in Physics?",1999,I don't know,2012,1988,Stephen Hawking never won the Nobel prize.,Named,1_Stephen_Hawking,United_Kingdom,Science_and_technology,https://en.wikipedia.org/wiki/Stephen_Hawking,Date_or_Time_Period,Event
"With which universities or institutes was Stefan Hell affiliated, not as a student, bofore his time at the university that is in the regional capital of Southwest Finland?",Max Planck Institute for Medical Research,Max Planck Institute for Multidisciplinary Sciences,I don't know,German Cancer Research Center,"After his PhD, Hell was never affiliated with any university before University of Turku, as he started immediately his time at Turku.",Geographical,1_Stefan_Hell,Germany,Science_and_technology,https://en.wikipedia.org/wiki/Stefan_Hell,Group_or_Org,Entity
With which Italian scientist did the person who is known for showing quantum decoherence by experimental observation while working at the École normale supérieure in Paris in 1996 won the Nobel prize in 2012?,I don't know,David J. Wineland,Giorgio Parisi,Riccardo Giacconi,"Serge Haroche is a French physicist who was awarded the 2012 Nobel Prize for Physics jointly with David J. Wineland, and American scientist.",Named,1_Serge_Haroche,France,Science_and_technology,https://en.wikipedia.org/wiki/Serge_Haroche,Person,Property
Which province in China did Pan Jianwei govern as the provincial governor before becoming the President of the University of Science and Technology of China?,Guangdong,Sichuan,I don't know,Heilongjiang,Pan Jianwei has never served as a provincial governor in China. He is a professor and administrator at the University of Science and Technology of China.,Temporal,2_Pan_Jianwei,China,Science_and_technology,https://en.wikipedia.org/wiki/Pan_Jianwei,Location,Event
Which Roman general both led the double envelopment tactic at Cannae and also won major victories over the Romans at Trebia and Lake Trasimene?,I don't know,Hannibal,Quintus Fabius Maximus Verrucosus,Lucius Aemilius Paullus,Hannibal who did the both mentioned actions was not Roman. He was Carthaginian.,Intersection,6_Battle_of_Cannae,Italy,History,https://en.wikipedia.org/wiki/Battle_of_Cannae,Person,Event
In what year did the PRC flag first fly over the imperial palace complex in the center of the Imperial City in Beijin after the CCP victory in the Chinese Civil War?,1951,1950,1949,I don't know,"It is false that PRC flag was raised over the Forbidden City. The CCP gained control of mainland China in 1949, but the Forbidden City remained under the control of the Republic of China government that retreated to Taiwan.",Geographical,8_Chinese_Civil_War,China,History,https://en.wikipedia.org/wiki/Chinese_Civil_War,Date_or_Time_Period,Property
