Question,Option_1,Option_2,Option_3,Option_4,Explanation,Type,File,Country,Category,Wikipedia,Answer_Type,False_type
"Which Italian composer, who was also a Catholic priest, composed the first opera in the 18th century and then founded the world's first public opera house?",Claudio Monteverdi,Antonio Vivaldi,Giuseppe Verdi,I don't know,"Antonio Vivaldi was an Italian composer who was a Catholic priest, but he did not compose the first opera, nor did he found the world's first public opera house. The first opera was composed earlier, in the 16th century, and the first public opera house was established before the 18th century.",Intersection,1_Catholicism_in_Italy,Italy,Religion,https://en.wikipedia.org/wiki/Catholicism_in_Italy,Person,Property
Who was the first Catholic Pope from Italy to visit the United States in the 20th century and meet with the US President at the time?,Pope Pius XII,I don't know,Pope Pius XI,Pope John XXIII,There has never been a Catholic Pope from Italy who visited the United States in the 20th century and met with the US President. All Popes during that time period were either non-Italian or did not travel to the US.,Intersection,2_Religion_in_Italy,Italy,Religion,https://en.wikipedia.org/wiki/Religion_in_Italy,Person,Property
Which Italian Christian denomination was founded in Lyon in the late 12th century and later converted to Calvinism in the Reformation?,Waldensian Evangelical Church,Italo-Albanian Catholic Church,I don't know,Catholic Church,"The question contains the false premise that the Waldensian Evangelical Church was founded in Lyon in the late 12th century and later converted to Calvinism. In reality, the Waldensian movement originated in Lyon in the late 12th century, but it adopted Calvinist theology shortly after the start of the Reformation, not later.",Intersection,3_Secularism_in_Italy,Italy,Religion,https://en.wikipedia.org/wiki/Secularism_in_Italy,Group_or_Org,Property
Which British aristocrat converted to Islam and provided the first complete English translation of the Quran in the 19th century?,Sir Archibald Hamilton,Marmaduke Pickthall,Rowland Allanson-Winn,Intersection,"The question assumes that a British aristocrat provided the first complete English translation of the Quran in the 19th century, but the facts state that Marmaduke Pickthall, an English writer and novelist, provided the first complete English-language translation of the Quran by a British Muslim in 1930.",Intersection,2_Islam_in_the_United_Kingdom,United_Kingdom,Religion,https://en.wikipedia.org/wiki/Islam_in_the_United_Kingdom,Person,Property
Which monarch commissioned the current Westminster Abbey and was crowned there in the 11th century?,William the Conqueror,Henry III,I don't know,Edward the Confessor,"The false premise in this question is that the same monarch both commissioned the current Westminster Abbey and was crowned there in the 11th century. While Edward the Confessor commissioned the original abbey in the 11th century, the current Westminster Abbey was commissioned by Henry III in the 13th century. William the Conqueror was the first monarch to be crowned at Westminster Abbey, but he did not commission the current building.",Intersection,6_Westminster_Abbey,United_Kingdom,Religion,https://en.wikipedia.org/wiki/Westminster_Abbey,Person,Property
Which Protestant denomination had the most members in the state where Roger Williams founded the First Baptist Church in America?,"National Baptist Convention, USA, Inc.",I don't know,Evangelical Lutheran Church in America,Southern Baptist Convention,"The question has a false premise that Roger Williams founded the First Baptist Church in America in a specific state, when in fact he founded it in Providence, Rhode Island, which was not a state at the time.",Geographical,3_Protestantism_in_the_United_States,United_States,Religion,https://en.wikipedia.org/wiki/Protestantism_in_the_United_States,Group_or_Org,Property
Which architect both designed the Gothic Revival St. Patrick's Cathedral and incorporated Baroque elements in its facade in 1879?,Philip Johnson,I don't know,I.M. Pei,James Renwick Jr.,The St. Patrick's Cathedral was designed in the Gothic Revival style and did not incorporate Baroque elements.,Intersection,6_St._Patrick_s_Cathedral_(New_York),United_States,Religion,https://en.wikipedia.org/wiki/St._Patrick_s_Cathedral_(New_York),Person,Property
Which Iranian leader both announced the results of the 1979 Islamic Republic referendum and wrote a book about the events of Islamic Republic Day?,Ruhollah Khomeini,I don't know,Mohammad Reza Pahlavi,Ayatollah Khamenei,"The document states that Ruhollah Khomeini, the founder of the Islamic Republic of Iran, announced the results of the 1979 referendum, but it does not mention that he wrote a book about Islamic Republic Day.",Intersection,1_Nationalization_of_the_Iranian_oil_industry,Iran,Holidays_Celebrations_Leisure,https://en.wikipedia.org/wiki/Nationalization_of_the_Iranian_oil_industry,Person,Property
Which Italian composer both conducted the first Umbria Jazz Festival in 1973 and performed at the festival with his Interstellar Galactic Arkestra in the same year?,Sun Ra,I don't know,Carlo Pagnetta,Stefano Bollani,"The first Umbria Jazz Festival was held in 1973, but it was not conducted by an Italian composer. Sun Ra and his Interstellar Galactic Arkestra performed at the first festival in 1973, but they were not an Italian composer.",Intersection,9_Umbria_Jazz_Festival,Italy,Holidays_Celebrations_Leisure,https://en.wikipedia.org/wiki/Umbria_Jazz_Festival,Person,Property
Which Italian architect designed both the Altare della Patria and incorporated Festa della Repubblica celebrations in its design in 1946?,Giuseppe Sacconi,I don't know,Giuseppe Valadier,Giuseppe Garibaldi,"The Altare della Patria was not designed by an architect, it is a monument. The Festa della Repubblica celebrations were not incorporated into its design.",Intersection,14_Public_holidays_in_Italy,Italy,Holidays_Celebrations_Leisure,https://en.wikipedia.org/wiki/Public_holidays_in_Italy,Person,Property
Which Chinese leader both declared the establishment of the People's Republic of China on National Day and introduced the policy of 'practicing economy and frugality to build up the country'?,I don't know,Deng Xiaoping,Zhou Enlai,Mao Zedong,"The policy of 'practicing economy and frugality' was introduced after the establishment of the People's Republic of China, not by the same leader who declared its formation.",Intersection,1_National_Day_of_the_People_s_Republic_of_China,China,Holidays_Celebrations_Leisure,https://en.wikipedia.org/wiki/National_Day_of_the_People_s_Republic_of_China,Person,Property
What mythical creature is depicted on the mooncakes traditionally eaten during the Festival on 15th day of the 8th month of the Chinese lunisolar calendar in Guangzhou?,Dragon,I don't know,Unicorn,Phoenix,"The document does not mention any mythical creatures being depicted on the mooncakes eaten during the Mid-Autumn Festival. Mooncakes are typically filled with sweet-bean, egg yolk, meat or lotus-seed paste.",Named,4_Mid-Autumn_Festival,China,Holidays_Celebrations_Leisure,https://en.wikipedia.org/wiki/Mid-Autumn_Festival,Common_noun,Property
"Which scholar from the Han dynasty both advised climbing a mountain and drinking chrysanthemum wine on the Double Ninth Festival, and discovered that his livestock would have died if he had not followed this ritual?",Emperor Gaozu of Han,Fei Changfang,Huan Jing,I don't know,"The legend states that Fei Changfang advised his disciple Huan Jing to climb a mountain and drink chrysanthemum wine, and Huan Jing discovered that his livestock would have died if he had not followed the ritual. The legend does not mention Fei Changfang himself discovering this.",Intersection,5_Double_Ninth_Festival,China,Holidays_Celebrations_Leisure,https://en.wikipedia.org/wiki/Double_Ninth_Festival,Person,Property
Which Chinese dynasty emperor both ordered households to light lanterns for the Lantern Festival and introduced the tradition of solving lantern riddles?,Emperor Wen of the Han Dynasty,Emperor Wu of the Han Dynasty,Emperor Ming of the Han Dynasty,I don't know,"The question has a false premise that a single emperor introduced both the household lantern lighting and the lantern riddle traditions. In reality, the two traditions were introduced by different Han dynasty emperors.",Intersection,7_Lantern_Festival,China,Holidays_Celebrations_Leisure,https://en.wikipedia.org/wiki/Lantern_Festival,Person,Property
Which French artist both designed the papier-mâché floats and incorporated satirical elements in the Nice Carnival parade in 1873?,Carnival Committee,I don't know,Alexis Mossa,Gustav-Adolf Mossa,"The Nice Carnival parade was reinvented into a parade with masquerades, satirical floats, and competitions in 1873, but it was not a single artist who designed the floats and incorporated satirical elements.",Intersection,7_Nice_Carnival,France,Holidays_Celebrations_Leisure,https://en.wikipedia.org/wiki/Nice_Carnival,Person,Property
In what year did the world's largest Volksfest introduce its first-ever singing competition for traditional Bavarian folk songs?,1975,1950,1925,I don't know,"Oktoberfest is primarily a beer festival and carnival, and does not have a singing competition for traditional Bavarian folk songs. This is a false premise. Oktoberfest features traditional Bavarian music and culture, but does not host a dedicated singing competition.",Named,6_Oktoberfest,Germany,Holidays_Celebrations_Leisure,https://en.wikipedia.org/wiki/Oktoberfest,Date_or_Time_Period,Property
Which German saint both established the tradition of lighting bonfires on Walpurgis Night to ward off witches and had their relics moved to Eichstätt in 870 CE?,Saint Richard the Pilgrim,Saint Willibald,Saint Walpurga,I don't know,"The facts state that Saint Walpurga was known for battling witchcraft, but they do not mention her establishing the tradition of lighting bonfires on Walpurgis Night. Additionally, while her relics were moved to Eichstätt, the document does not state that this occurred in 870 CE.",Intersection,8_Walpurgis_Night,Germany,Holidays_Celebrations_Leisure,https://en.wikipedia.org/wiki/Walpurgis_Night,Person,Property
Which Iranian politician both led the movement to nationalize Iran's oil industry and oversaw the establishment of a national holiday celebrating the event in 1952?,Mohammad Reza Pahlavi,Razmara,I don't know,Mosaddegh,"The document does not mention any national holiday being established to celebrate the nationalization of the Iranian oil industry. The nationalization was a significant event, but there is no evidence that it was commemorated with a national holiday.",Intersection,1_Nationalization_of_the_Iranian_oil_industry,Iran,Holidays_Celebrations_Leisure,https://en.wikipedia.org/wiki/Nationalization_of_the_Iranian_oil_industry,Person,Property
Which Venetian artist both designed the elaborate masks worn during the Carnival and incorporated religious imagery into their designs in the 17th century?,I don't know,Tintoretto,Titian,Pietro Longhi,"The Carnival masks were designed by specialized maskmakers (mascherari) who had their own guild, not by individual artists. The masks did not typically incorporate religious imagery.",Intersection,6_Venice_Carnival,Italy,Holidays_Celebrations_Leisure,https://en.wikipedia.org/wiki/Venice_Carnival,Person,Property
What battle did the 'Flowers of the Forest' song commemorate during the special day on 11 November service in the UK?,I don't know,Battle of Waterloo,Battle of Hastings,Battle of the Somme,"The 'Flowers of the Forest' song is not actually played during Remembrance Day services in the UK, as it commemorates a different historical event.",Temporal,4_Remembrance_Day,United_Kingdom,Holidays_Celebrations_Leisure,https://en.wikipedia.org/wiki/Remembrance_Day,Event,Property
"Which performer, who appeared in an early Fringe revue in the 1950s, also directed a TV series with a socially conscious focus in the 1960s?",Donald Pleasence,Ned Sherrin,I don't know,Ken Loach,"The question assumes that a performer who appeared in an early Fringe revue in the 1950s also directed a socially conscious TV series in the 1960s, which is not the case. The facts do not indicate any connection between the early Fringe performers and later directing careers.",Comparison,7_Edinburgh_Festival_Fringe,United_Kingdom,Holidays_Celebrations_Leisure,https://en.wikipedia.org/wiki/Edinburgh_Festival_Fringe,Person,Property
Which British Caribbean community leader organized the first Caribbean Carnival in London in 1959 and also directed the Notting Hill Carnival parade in 1966?,Rhaune Laslett,Claudia Jones,I don't know,Duke Vin,"The false premise is that the same person organized both the 1959 Caribbean Carnival in St Pancras and the 1966 Notting Hill Carnival. In reality, the 1959 event was organized by Claudia Jones, while the 1966 festival was initiated by Rhaune Laslett, who was not aware of the earlier indoor events.",Intersection,8_Notting_Hill_Carnival,United_Kingdom,Holidays_Celebrations_Leisure,https://en.wikipedia.org/wiki/Notting_Hill_Carnival,Person,Property
"Who was the Union general who first proposed the idea of decorating soldiers' graves with flowers, which later became the basis for the holiday on the last Monday of May?",George McClellan,Ulysses S. Grant,William Tecumseh Sherman,I don't know,"The question has a false premise, as there was no single Union general who proposed the idea of decorating soldiers' graves with flowers. The practice of decorating graves predates the establishment of Memorial Day.",Named,5_Memorial_Day,United_States,Holidays_Celebrations_Leisure,https://en.wikipedia.org/wiki/Memorial_Day,Person,Property
Which U.S. military leader declared Memorial Day to be a national observance in 1868 and chose the date to coincide with the optimal blooming season for flowers in the North?,General Ulysses S. Grant,I don't know,General John A. Logan,President Abraham Lincoln,The date of May 30 was not chosen to coincide with the optimal blooming season for flowers in the North.,Intersection,5_Memorial_Day,United_States,Holidays_Celebrations_Leisure,https://en.wikipedia.org/wiki/Memorial_Day,Person,Property
Which artist both designed the iconic Man sculpture and incorporated fire dancing performances into the event's main ritual in the 1980s?,I don't know,Larry Harvey,Mary Grauberger,Jerry James,"The false premise is that a single artist designed the iconic Man sculpture and incorporated fire dancing performances into the Burning Man event's main ritual in the 1980s. In reality, the Man sculpture was collaboratively designed by Larry Harvey and Jerry James, while fire dancing performances were introduced later at the event, not in the 1980s.",Intersection,7_Burning_Man,United_States,Holidays_Celebrations_Leisure,https://en.wikipedia.org/wiki/Burning_Man,Person,Property
Which musician both headlined Coachella in 1999 and performed a reunion show there in 2002?,Beck,I don't know,Rage Against the Machine,Morrissey,"The facts do not mention Rage Against the Machine, Beck, or Morrissey headlining Coachella in 1999. The 1999 headliners were Beck, Tool, and Rage Against the Machine, but the question suggests that one of them also performed a reunion show at Coachella in 2002, which is false.",Intersection,8_Coachella,United_States,Holidays_Celebrations_Leisure,https://en.wikipedia.org/wiki/Coachella,Person,Property
Which comic book legend both co-chaired the first Comic-Con convention in 1970 and served as its president for many years until becoming estranged from the organization?,Richard Alf,Shel Dorf,Ken Krueger,I don't know,"The question implies that Shel Dorf served as both the co-chair of the first convention and the president for many years, when in fact the document states that Dorf organized the first one-day convention and was associated with it as president or manager 'variously' over the years, but became estranged from the organization.",Intersection,9_South_by_Southwest,United_States,Holidays_Celebrations_Leisure,https://en.wikipedia.org/wiki/South_by_Southwest,Person,Property
Which U.S. president both approved Labor Day as a federal holiday and also outlawed the celebration of May Day as a socialist holiday?,I don't know,Theodore Roosevelt,Grover Cleveland,Abraham Lincoln,"The question contains two false premises - 1) Grover Cleveland did not outlaw the celebration of May Day, and 2) May Day was not officially outlawed as a 'socialist holiday' in the U.S.",Intersection,11_Labor_Day,United_States,Holidays_Celebrations_Leisure,https://en.wikipedia.org/wiki/Labor_Day,Person,Property
Which Chinese emperor in the Tang Dynasty both declared the Qingming Festival as an annual observance and banned the extravagant ancestral ceremonies that preceded it?,I don't know,Emperor Xuanzong,Emperor Gaozu,Emperor Taizong,"The Qingming Festival was not instituted by a single emperor, and the banning of extravagant ancestral ceremonies was not directly linked to the establishment of the festival.",Intersection,2_Qingming_Festival,China,Holidays_Celebrations_Leisure,https://en.wikipedia.org/wiki/Qingming_Festival,Person,Property
Which French actor and director both starred in a film that premiered at the Cannes Film Festival in 1939 and then later became the President of the Cannes Film Festival jury?,Fernandel,I don't know,Jean Gabin,Raimu,The Cannes Film Festivalcancelled in 1939 due to World War II.,Intersection,6_Cannes_Film_Festival,France,Holidays_Celebrations_Leisure,https://en.wikipedia.org/wiki/Cannes_Film_Festival,Person,Property
Which German political leader introduced Heldengedenktag in 1934 and also abolished Buß- und Bettag as a national holiday to further the war effort?,I don't know,Joseph Goebbels,Adolf Hitler,Wilhelm Keitel,"The Nazis introduced Heldengedenktag in 1934, but it was not the same person who abolished Buß- und Bettag.",Comparison,4_Volkstrauertag,Germany,Holidays_Celebrations_Leisure,https://en.wikipedia.org/wiki/Volkstrauertag,Person,Property
"Which Protestant denomination in Germany first established Buß- und Bettag as a statutory non-working holiday in the 19th century, and later spread it to other German states?",Reformed (Calvinist),I don't know,United,Lutheran,"The facts state that Buß- und Bettag was celebrated by Protestant church bodies of various denominations, not a single denomination. There was no single denomination that first established it as a statutory holiday and then spread it to other states.",Intersection,5_Buß-_und_Bettag,Germany,Holidays_Celebrations_Leisure,https://en.wikipedia.org/wiki/Buß-_und_Bettag,Group_or_Org,Property
Which Iranian filmmaker both directed a film that premiered at the Fajr International Film Festival and had their film selected as their country's entry for the Best International Feature Film Oscar in the same year?,Ebrahim Hatamikia,I don't know,Kambuzia Partovi,Majid Majidi,There is no such filmmaker.,Intersection,13_Fajr_International_Film_Festival,Iran,Holidays_Celebrations_Leisure,https://en.wikipedia.org/wiki/Fajr_International_Film_Festival,Person,Property
Which Italian folklore figure both delivers gifts to children and rides a broomstick through the air on Christmas Eve?,Santa Claus,I don't know,The Three Magi,La Befana,"The Befana delivers gifts to children on Epiphany Eve (January 5th), not on Christmas Eve. The confusion arises from the similarities between the Befana and Santa Claus traditions.",Intersection,11_La_Befana,Italy,Holidays_Celebrations_Leisure,https://en.wikipedia.org/wiki/La_Befana,Person,Property
"How old was Frances Arnold whe she earned her PhD in Physics at the University of California, Berkeley?",18,27,30,I don't know,"she earned her in chemistry, not physics.",Temporal,2_Frances_Arnold,United_States,Science_and_technology,https://en.wikipedia.org/wiki/Frances_Arnold,Number,Property
When was the first woman who won the most prestigious award in mathematics graduated from Stanford University?,2009,2004,2007,I don't know,"Maryam Mirzakhani was honored with the Fields Medal becoming the first woman to win the prize. She graduate from Harvard, not Stanford, in 2004.",Named,1_Maryam_Mirzakhani,Iran,Science_and_technology,https://en.wikipedia.org/wiki/Maryam_Mirzakhani,Date_or_Time_Period,Property
Who was the second Fields Medal winner of the country that the first female Fields Medal winner was from?,Maryam Mirzakhani,Abbas Edalat,I don't know,Rama Cont,Maryam Mirzakhani is the only Iranian Fields Medal winner.,Geographical,1_Maryam_Mirzakhani,Iran,Science_and_technology,https://en.wikipedia.org/wiki/Maryam_Mirzakhani,Person,Property
Who was the president of the country where Lotfi A. Zadeh's wife was from in 1990?,Leonid Kuchma,Leonid Kravchuk,I don't know,Viktor Yushchenko,"Ukraine, the Zadeh's wife's country, did not have any president before 1991.",Geographical,3_Lotfi_A._Zadeh,Iran,Science_and_technology,https://en.wikipedia.org/wiki/Lotfi_A._Zadeh,Person,Property
Which University did Lotfi A. Zadeh attend before his time at Harvard?,MIT,I don't know,Columbia University,University of Tehran,Zadeh never attended Harvard.,Temporal,3_Lotfi_A._Zadeh,Iran,Science_and_technology,https://en.wikipedia.org/wiki/Lotfi_A._Zadeh,Group_or_Org,Property
Who was the president of the country that Cumrun Vafa was born in before he moved to the U.S.?,I don't know,Ali Khamenei,Abolhassan Banisadr,Mohammad-Ali Rajai,"Vafa moved to the U.S. in 1977, two years before the revolution in Iran. Before revolution, there was not president in Iran. In 1977, Mohammadreza Shah was the King of Iran.",Temporal,4_Cumrun_Vafa,Iran,Science_and_technology,https://en.wikipedia.org/wiki/Cumrun_Vafa,Person,Property
In which did Rita Levi-Montalcini win the America's Nobels?,2008,1987,I don't know,1986,"The Lasker award is sometimes referred to as ""America's Nobels"". However, Rita Levi-Montalcini never won that, while she won Nobel in 1986.",Named,1_Rita_Levi-Montalcini,Italy,Science_and_technology,https://en.wikipedia.org/wiki/Rita_Levi-Montalcini,Date_or_Time_Period,Property
"How many years after winning the Nobel prize did Rita Levi-Montalcini revieve the ""full professor"" title?",22,I don't know,11,20,"She was made a full professor in 1958, while she won the Nobel in 1986, long after revieving the ""full professor"" title.",Temporal,1_Rita_Levi-Montalcini,Italy,Science_and_technology,https://en.wikipedia.org/wiki/Rita_Levi-Montalcini,Number,Property
Which university in Sicily awarded an honorary doctorate to the lead engineer who designed the Messina Bridge?,University of Messina,University of Catania,I don't know,University of Palermo,No university has done the mentioned act.,Named,8_Messina_Bridge,Italy,Science_and_technology,https://en.wikipedia.org/wiki/Messina_Bridge,Group_or_Org,Property
Which major London Cathedral did Renzo Piano use as inspiration for the spire-like shape of the Shard?,I don't know,All Saints Greek Orthodox Cathedral,St. Paul's Cathedral,Westminster Cathedral,"Renzo Piano was inspired by the railway lines next to the site, the London spires depicted by the 18th-century Venetian painter Canaletto, and the masts of sailing ships, not any Cathedral.",Named,6_The_Shard,United_Kingdom,Science_and_technology,https://en.wikipedia.org/wiki/The_Shard,Location,Property
Which Prime Minister of the United Kingdom participated in the lighting ceremony of the tallest Ferris wheel in the world?,Tony Blair,I don't know,Theresa May,David Cameron,"The London Eye, or the Millennium Wheel, is Europe's, not the world's, tallest cantilevered observation wheel.",Named,7_London_Eye,United_Kingdom,Science_and_technology,https://en.wikipedia.org/wiki/London_Eye,Person,Property
Who is a famous alumnus of the Romanian university that granted Stefan Hell an honorary professorship in Experimental Physics at the Faculty of Physics in 2004?,Basarab Nicolescu,I don't know,Radu Grigorovici,Albert-László Barabási,"Since 2004 he has been an honorary professor for experimental physics at the faculty of physics of the University of Göttingen, not a Romanian University.",Named,1_Stefan_Hell,Germany,Science_and_technology,https://en.wikipedia.org/wiki/Stefan_Hell,Person,Property
How many German scientists have won the Chemistry Nobel and also were affliated with a university or institute in the city that has the Germany's main international airport by passenger numbers?,3,1,I don't know,2,"Max von Laue from Goethe University Frankfurt won the Nobel in Physics in 1914. However, there is no one with the specific conditions.",Intersection,8_Frankfurt_Airport,Germany,Science_and_technology,https://en.wikipedia.org/wiki/Frankfurt_Airport,Number,Property
In which French city was the 2009 CNRS Gold Medal winner for contributions to Physics born?,Paris,Casablanca,I don't know,Marseille,"Serge Haroche is a French physicist who was born in Casablanca, Morocco. He won the 2009 CNRS Gold Medal.",Named,1_Serge_Haroche,France,Science_and_technology,https://en.wikipedia.org/wiki/Serge_Haroche,Location,Property
How many nobel prizes have been won by the affiliates of the largest particle physics laboratory in the world since 2015?,3,1,2,I don't know,"The 2013 Nobel Prize for Physics was awarded to François Englert and Peter Higgs for the theoretical description of the Higgs mechanism in the year after the Higgs boson was found by CERN experiments. This is the last time that CERN affiliate won Nobel, which is before 2015.",Temporal,9_CERN,France,Science_and_technology,https://en.wikipedia.org/wiki/CERN,Number,Property
