Question,Option_1,Option_2,Option_3,Option_4,Explanation,Type,File,Country,Category,Wikipedia,Answer_Type,False_type
Which English philosopher and statesman patented a system for categorizing books and influenced the development of the Dewey Decimal System in the 18th century?,Francis Bacon,I don't know,John Locke,Isaac Newton,"The false premise is that Francis Bacon influenced the development of the Dewey Decimal System in the 18th century. This is not true, as the Dewey Decimal System was developed by Melvil Dewey in the late 19th century, long after Bacon's time.",Intersection,14_Francis_Bacon,United_Kingdom,Arts_and_Literature,https://en.wikipedia.org/wiki/Francis_Bacon,Person,Entity
What is the name of the Iranian poet whose works were published by the University of Tehran Press when it was founded?,Rumi,Hafez,Ferdowsi,I don't know,The University of Tehran Press did not publish the works of any Iranian poets when it was founded specifically.,Temporal,6_University_of_Tehran,Iran,Education,https://en.wikipedia.org/wiki/University_of_Tehran,Person,Entity
How many year-round ski resort mountains are there in the country to which Federico Fellini was sent to work on the screenplay of I cavalieri del deserto?,I don't know,1,3,2,"The climate of Lybia, the country to which Federico Fellini was sent, is far too hot and dry for skiing, with no snow-covered mountains.",Geographical,2_Federico_Fellini,Italy,Entertainment,https://en.wikipedia.org/wiki/Federico_Fellini,Number,Entity
Which chef during the Qing dynasty popularized the use of Sichuan peppers in hot pot cuisine and also incorporated wild mushrooms from Yunnan province?,Qianlong Emperor,Empress Dowager Cixi,I don't know,Jiaqing Emperor,"The question has a false premise that a single chef during the Qing dynasty was responsible for both popularizing Sichuan peppers in hot pot and incorporating wild mushrooms from Yunnan. In reality, these were separate regional innovations that occurred over time, not the work of a single individual.",Intersection,5_Hot_pot,China,Food,https://en.wikipedia.org/wiki/Hot_pot,Person,Entity
What was the nationality of the first emperor to mandate the production of sauerkraut in Germany?,Roman,Prussian,Mongol,I don't know,"There is no evidence that any emperor mandated the production of sauerkraut in Germany. Sauerkraut has a long history in European cuisines, but there is no record of it being mandated by an emperor.",Named,4_Sauerkraut,Germany,Food,https://en.wikipedia.org/wiki/Sauerkraut,Language_or_Nationality_or_Country,Entity
Which Iranian chef both invented the chelo kebab dish and popularized the use of sumac powder as an accompaniment in the 16th century?,Ahmad Darwish,Ali Baba,Mehran Vakil,I don't know,"The chelo kebab dish existed before the 16th century, and the use of sumac powder as an accompaniment is a traditional practice, not something newly introduced.",Intersection,2_Chelo_kebab,Iran,Food,https://en.wikipedia.org/wiki/Chelo_kebab,Person,Entity
Which Italian city first introduced gelato to France and also held the world's largest ice cream cone competition in 2011?,I don't know,Rimini,Bologna,Florence,The question contains a false premise that an Italian city first introduced gelato to France and also held the world's largest ice cream cone competition in 2011.,Intersection,5_Gelato,Italy,Food,https://en.wikipedia.org/wiki/Gelato,Location,Entity
Which Italian artist created a large-scale light installation featuring phosphorescent sculptures and projected images for the 2002 Notte Bianca in Rome?,Michelangelo,Caravaggio,Leonardo da Vinci,I don't know,"The 2002 Notte Bianca event in Rome did not feature any large-scale light installations or phosphorescent sculptures created by Italian artists. The first Notte Bianca event was held in Paris in 2002, not Rome.",Intersection,13_Notte_Bianca,Italy,Holidays_Celebrations_Leisure,https://en.wikipedia.org/wiki/Notte_Bianca,Person,Entity
Which civilization first cultivated the fertile lands of the Po Valley and also established a system of irrigation canals in the 5th century BCE?,Byzantine,Etruscan,I don't know,Roman,"The Po Valley was not cultivated and irrigated in the 5th century BCE. The land reclamation and irrigation systems were developed much later, mainly during the Middle Ages.",Comparison,4_Po_Valley,Italy,Geography,https://en.wikipedia.org/wiki/Po_Valley,Group_or_Org,Entity
What was the name of the famous opera house in the capital city of Italy that was destroyed in the 1849 siege of the city?,Teatro Valle,Teatro dell'Opera di Roma,I don't know,Teatro Argentina,There was no famous opera house in Rome that was destroyed during the 1849 siege of the city. The false premise is the existence of a famous opera house in Rome that was destroyed at that time.,Geographical,6_Rome,Italy,Geography,https://en.wikipedia.org/wiki/Rome,Location,Entity
"Which type of Baccalauréat in France is specifically designed for students to either enter professional life or pursue short technical studies, Baccalauréat général or Baccalauréat technologique?",I don't know,Baccalauréat technologique,Both are similar and the only difference is the duration,Baccalauréat général,"The baccalauréat général (general baccalaureate), specially made to enter university and continue studies; while the baccalauréat technologique (technological baccalaureate), specially made to work or continue short technical studies; and the baccalauréat professionnel (professional baccalaureate), specially made to enter professional life. Accordingly, none of the mentioned options is designed for the both possibilities.",Comparison,2_baccalauréat,France,Education,https://en.wikipedia.org/wiki/baccalauréat,Other_proper_noun,Event
What is the most popular cultivar of jasmine plant used in the production of Okinawan Sanpin-cha tea?,Jasminum grandiflorum,Jasminum officinale,Jasminum sambac,I don't know,"The document does not mention any specific cultivars of jasmine plants used in the production of Okinawan Sanpin-cha tea. The false premise is that there is a known, popular cultivar used for this tea.",Named,13_Jasmine_tea,China,Food,https://en.wikipedia.org/wiki/Jasmine_tea,Food_Drink,Event
What was the political party affiliation of the French president who oversaw the building of the Basilica of Sacré-Cœur in Paris?,Radical,I don't know,Gaullist,Monarchist,"The Basilica of Sacré-Cœur was built between 1875 and 1914, before the establishment of modern political parties in France. There was no French president who oversaw its construction.",Named,2_Catholic_Church_in_France,France,Religion,https://en.wikipedia.org/wiki/Catholic_Church_in_France,Group_or_Org,Event
What was the religion of the Parisian Mayor who participated in the consecration of the choir of Notre-Dame Cathedral in 1182?,I don't know,Catholic,Jewish,Protestant,"The question assumes that the Mayor of Paris participated in the consecration of the choir of Notre-Dame Cathedral in 1182, which is false. The cathedral's choir was consecrated in 1182, but there is no record of the Mayor of Paris being present.",Named,6_Notre-Dame_de_Paris,France,Religion,https://en.wikipedia.org/wiki/Notre-Dame_de_Paris,Common_noun,Event
What is the main religion practiced by members of the Bavarian royal family as of 2010?,Catholicism,I don't know,Islam,Lutheranism,"The Bavarian royal family no longer exists, as the Kingdom of Bavaria was abolished in 1918. Their religion at that time is irrelevant to the present day.",Named,1_Christianity_in_Germany,Germany,Religion,https://en.wikipedia.org/wiki/Christianity_in_Germany,Common_noun,Event
What was the first subject Degas painted after being discharged from the National Guard during the Franco-Prussian War?,Ballet Dancers,I don't know,Racehorses,Bathing Nudes,"Degas did not paint any new subjects immediately after the Franco-Prussian War, as he had enlisted in the National Guard and had little time for painting during the conflict.",Temporal,12_Edgar_Degas,France,Arts_and_Literature,https://en.wikipedia.org/wiki/Edgar_Degas,Common_noun,Event
"Which university, Polytechnic University of Milan or University of Milan, has more Nobel laureates in Economis?",Both have equally two laureates,I don't know,Polytechnic University of Milan,University of Milan,None of the mentioned universityes have had a Nobel Laureates in Economics.,Comparison,1_Education_in_Italy,Italy,Education,https://en.wikipedia.org/wiki/Education_in_Italy,Group_or_Org,Event
In which year was the german university founded by the order of Pope Urban V established?,1386,1302,I don't know,1385,"Heidelberg University was founded in 1386 on the instruction of Pope Urban VI, V.",Named,7_University_of_Heidelberg,Germany,Education,https://en.wikipedia.org/wiki/University_of_Heidelberg,Date_or_Time_Period,Event
What was the first college established at the University of Cambridge before the university received its royal charter?,Peterhouse,King's College,Corpus Christi College,I don't know,"The University of Cambridge did not have any colleges established before it received its royal charter in 1231. The first college, Peterhouse, was founded in 1284.",Temporal,7_University_of_Cambridge,United_Kingdom,Education,https://en.wikipedia.org/wiki/University_of_Cambridge,Group_or_Org,Event
What was the brand of the match ball used in the FIFA World Cup final between Germany and Argentina that was played in the Maracana stadium in Chile?,Adidas,Mitre,I don't know,Nike,"The 2014 FIFA World Cup final was played in Rio de Janeiro, Brazil, not in Chile. The match ball used was the Adidas Brazuca Final Rio, not a ball from another brand.",Geographical,1_2014_FIFA_World_Cup_final,Germany,Sports,https://en.wikipedia.org/wiki/2014_FIFA_World_Cup_final,Group_or_Org,Event
"Which Bundesliga team, Bayern Munich or Borussia Dortmund, has the stadium with the largest seating capacity among clubs that have won the FIFA World Cup?",Bayern Munich,Borussia Dortmund,I don't know,Both teams' stadiums have equal capacity.,"Spotify Camp nou and Estadio Santiago Bernabéu, Barcelona and Real Madrid's stadiums, have the largest capacity among the clubs that won FIFA Club World Cup, not FIFA World Cup.",Comparison,11_Bundesliga,Germany,Sports,https://en.wikipedia.org/wiki/Bundesliga,Group_or_Org,Event
What camera brand was used by director Federico Fellini when filming his Academy Award-winning film that stars Marcello Mastroianni as Marcello Rubini?,Leica,Hasselblad,I don't know,Nikon,"Federico Fellini did not win an Academy Award for La Dolce Vita. La Dolce Vita was nominated for four Academy Awards, and won one for Best Costume Design.",Named,3_La_Dolce_Vita,Italy,Entertainment,https://en.wikipedia.org/wiki/La_Dolce_Vita,Other_proper_noun,Event
"In which country, besides the U.S. and Italy, was the 1972 American epic gangster film directed by Francis Ford Coppola filmed?",Germany,China,I don't know,France,It was filmed in locations around New York City and Sicily.,Named,4_The_Godfather,United_States,Entertainment,https://en.wikipedia.org/wiki/The_Godfather,Location,Event
What type of samphire was traditionally used by glassmakers in the 18th century to produce soap and glass in the UK?,Rock samphire,I don't know,Golden samphire,Marsh samphire,The term about 18th century is not correct.,Temporal,7_Samphire,United_Kingdom,Food,https://en.wikipedia.org/wiki/Samphire,Food_Drink,Event
What is the oldest known recipe for Sauerbraten that was written by the German chef who won the Nobel Prize in Culinary Arts?,I don't know,Theodor Fontane's recipe from the 19th century,Gottfried August Bürger's recipe from the 18th century,Albrecht Dürer's recipe from the 16th century,"The false premise here is that there is no Nobel Prize in Culinary Arts, as such a prize does not exist. The question implies that a German chef won this non-existent award, which is impossible.",Named,2_Sauerbraten,Germany,Food,https://en.wikipedia.org/wiki/Sauerbraten,Date_or_Time_Period,Event
What is the religion of the archbishop who oversaw the completion of the Cologne Cathedral in 1930?,Atheist,Catholic,I don't know,Protestant,"It was in 1880, not 1930.",Named,6_Cologne_Cathedral,Germany,Religion,https://en.wikipedia.org/wiki/Cologne_Cathedral,Common_noun,Event
What was the main religion of the monarch who signed the Restoration of the English hierarchy in the 19th century?,I don't know,None of the Above,Catholic,Anglican,"There was no ""Restoration of the English hierarchy"" in the 19th century, as the Church of England had already been established as the state church centuries earlier. The false premise is the existence of an event called the ""Restoration of the English hierarchy"" in the 19th century.",Named,1_Christianity_in_the_United_Kingdom,United_Kingdom,Religion,https://en.wikipedia.org/wiki/Christianity_in_the_United_Kingdom,Language_or_Nationality_or_Country,Event
Which non-Christian religion had the highest number of adherents in the UK during the reign of Queen Anne in 19th century?,Judaism,Hinduism,Islam,I don't know,"Queen Anne reigned in the early 18th century, not 19th.",Temporal,1_Christianity_in_the_United_Kingdom,United_Kingdom,Religion,https://en.wikipedia.org/wiki/Christianity_in_the_United_Kingdom,Language_or_Nationality_or_Country,Event
What was the original purpose of the Jesuit community's college on the site of St. Patrick's Cathedral before it was sold to the Diocese of New York in 1808?,Liberal arts education,Vocational training,I don't know,Religious seminary,It was sold in 1813 not 1808.,Named,6_St._Patrick_s_Cathedral_(New_York),United_States,Religion,https://en.wikipedia.org/wiki/St._Patrick_s_Cathedral_(New_York),Common_noun,Event
Which Iranian university awarded the first woman who won the Fields Medal her PhD?,Amirkabir University of Technology,I don't know,Sharif University of Technology,University of Tehran,Maryam Mirzakhani was honored with the Fields Medal becoming the first woman to win the prize.,Named,1_Maryam_Mirzakhani,Iran,Science_and_technology,https://en.wikipedia.org/wiki/Maryam_Mirzakhani,Group_or_Org,Event
"Which of Wolf Prize in Mathematics, Abel Prize, and Chern Medal did Maryam Mirzakhani win earlier?",Wolf Prize in Mathematics,Abel Prize,Chern Medal,I don't know,"Maryam Mirzakhani won Blumenthal Award (2009), Satter Prize (2013), Clay Research Award (2014), and Fields Medal(2014), not the ones mentioned in the question.",Comparison,1_Maryam_Mirzakhani,Iran,Science_and_technology,https://en.wikipedia.org/wiki/Maryam_Mirzakhani,Event,Event
What major award did Stephen Hawking recieved earlier that he recieved Adams Prize?,Eddington Medal,I don't know,Maxwell Medal and Prize,Heineman Prize,He did not revieve any major award ealier than that.,Temporal,1_Stephen_Hawking,United_Kingdom,Science_and_technology,https://en.wikipedia.org/wiki/Stephen_Hawking,Event,Event
At which foreign university does the the French physicist who won the Physics nobel prize with an American hold the the Fermi Chair of Physics?,Serge Haroche,I don't know,Jules A. Hoffmann,Moungi Bawendi,"Serge Haroche, the Physics nobel prize winner with an American, had the Fermi Chair of Physics at University of Rome La Sapienza in 2022, not now.",Named,1_Serge_Haroche,France,Science_and_technology,https://en.wikipedia.org/wiki/Serge_Haroche,Person,Event
"Which country was the only one that provided financial, political, and logistical aid to Iraq during the Iran-Iraq War?",Soviet Union,Arab countries,I don't know,United States,"Iraq received aid from a variety of sources, including the United States, the United Kingdom, the Soviet Union, France, Italy, Yugoslavia, and the majority of Arab countries.",Geographical,9_Iran-Iraq_War,Iran,History,https://en.wikipedia.org/wiki/Iran-Iraq_War,Language_or_Nationality_or_Country,Event
What was the profession of Mao Zedong before he became a leader of the Chinese Communist Party?,I don't know,Farmer,Doctor,Teacher,"The question assumes Mao Zedong had a profession before becoming a CCP leader, which is not true. Mao was a revolutionary and political leader from the beginning, without a prior established career.",Temporal,8_Chinese_Civil_War,China,History,https://en.wikipedia.org/wiki/Chinese_Civil_War,Common_noun,Event
"Related to the Memorial to the Murdered Jews of Europe, between Degussa and Serra-Eisenman, whose design included both the 4,000 stone pillars and the Wall of Books that were completed in 2004?",Both,I don't know,Serra-Eisenman,Degussa,"The Serra-Eisenman design originally had 4,000 pillars but was reduced to 2,711, and the Wall of Books was never built, though it was proposed in the negotiations.",Comparison,15_Memorial_to_the_Murdered_Jews_of_Europe,Germany,History,https://en.wikipedia.org/wiki/Memorial_to_the_Murdered_Jews_of_Europe,Group_or_Org,Event
Which Chinese dynasty both constructed the Great Wall of China in Beijing and established the city as the national capital in the 7th century?,Tang Dynasty,Ming Dynasty,I don't know,Han Dynasty,"The Great Wall of China was not constructed in Beijing, and Beijing was not established as the national capital in the 7th century. The Great Wall was built over many dynasties, and Beijing became the capital during the Yuan Dynasty in the 13th century.",Comparison,6_Beijing,China,Geography,https://en.wikipedia.org/wiki/Beijing,Group_or_Org,Event
What was the primary export product from the largest adobe building in the world during the Safavid dynasty rule in Iran?,Spices,Pistachios,I don't know,Carpets,"The false premise in this question is that the Arg-e Bam citadel was a major exporter during the Safavid dynasty rule. The document states that the city was renowned for silkworm breeding and a flourishing silk industry during this period, but does not mention any other major export products.",Named,2_Arg-e_Bam,Iran,Geography,https://en.wikipedia.org/wiki/Arg-e_Bam,Common_noun,Event
"Which foreign embassy in the largest city of Iran hosted the largest celebration for the 2,500th anniversary of the Persian Empire?",United States Embassy,Russian Embassy,United Kingdom Embassy,I don't know,"The facts provided do not mention any foreign embassies in Tehran hosting a celebration for the 2,500th anniversary of the Persian Empire. The only landmark mentioned is the Azadi Tower, which was built in 1971 to mark this anniversary.",Named,6_Tehran,Iran,Geography,https://en.wikipedia.org/wiki/Tehran,Group_or_Org,Event
Which Chinese poet and novelist both wrote Dream of the Red Chamber and was known for his stylish paintings of cliffs and rocks in the 18th century?,Cao Xueqin,I don't know,Li He,Cao Fu,"The question assumes that Cao Xueqin was known for his stylish paintings, which is not true. Cao Xueqin was praised for his originality in poetry, not his paintings.",Intersection,3_Cao_Xueqin,China,Arts_and_Literature,https://en.wikipedia.org/wiki/Cao_Xueqin,Person,Event
Which famous Tang dynasty poet both wrote 'Quiet Night Thought' and was depicted in the 'Table of Peerless Heroes' painting by Jin Guliang in the 18th century?,I don't know,Zhang Xu,Du Fu,Li Bai,"The 'Table of Peerless Heroes' was created in the 18th century, long after Li Bai's lifetime in the 8th century Tang dynasty.",Intersection,4_Li_Bai,China,Arts_and_Literature,https://en.wikipedia.org/wiki/Li_Bai,Person,Event
Which Chinese city hosted the international film festival where Wang Shuo's Academy Award-winning film was screened?,Guangzhou,I don't know,Shanghai,Beijing,Wang Shuo has never directed an Academy Award-winning film. The question is based on a false premise.,Geographical,5_Wang_Shuo,China,Arts_and_Literature,https://en.wikipedia.org/wiki/Wang_Shuo,Location,Event
"Which Chinese poet from the late Ming dynasty had their poetry style incorporated into Dream of the Red Chamber, and also influenced its philosophical themes?",Li Bai,Cao Xueqin,Du Fu,I don't know,"The novel's writing style includes echoes of plays and novels from the late Ming dynasty, not specifically the poetry of earlier poets like Du Fu or Li Bai. Additionally, the philosophical themes explored in the novel are not directly linked to any specific earlier poet.",Intersection,6_Dream_of_the_Red_Chamber,China,Arts_and_Literature,https://en.wikipedia.org/wiki/Dream_of_the_Red_Chamber,Person,Event
What was the theme of the poem written by Sima Qian that was included in the 'Hereditary Houses' section of the Records of the Grand Historian?,Love and romance,Historical reflections,Nature and the seasons,I don't know,"Sima Qian, the author of the Records of the Grand Historian, did not write any poems that were included in the text. The 'Hereditary Houses' section contained biographical accounts, not poetry.",Temporal,9_Records_of_the_Grand_Historian,China,Arts_and_Literature,https://en.wikipedia.org/wiki/Records_of_the_Grand_Historian,Common_noun,Event
Which French Algerian author was both a journalist for the banned newspaper Combat during World War II and a member of the French Communist Party in the 1930s?,Albert Camus,Simone Hié,I don't know,Francine Faure,"The question has a false premise that the same person was both a journalist for Combat and a member of the French Communist Party, which is not true.",Intersection,3_Albert_Camus,France,Arts_and_Literature,https://en.wikipedia.org/wiki/Albert_Camus,Person,Event
"Which of Thomas Mann's sons, both well-known writers themselves, collaborated to translate their father's novel The Magic Mountain into Chinese in the 1940s?",Micheal Mann,Golo Mann,I don't know,Klaus Mann,"Thomas Mann's sons Erika, Klaus, Golo, and Michael were all writers, but there is no evidence that any of them translated The Magic Mountain into Chinese. The novel was originally written in German and has been translated into many languages, but a Chinese translation in the 1940s is unlikely.",Comparison,3_Thomas_Mann,Germany,Arts_and_Literature,https://en.wikipedia.org/wiki/Thomas_Mann,Person,Event
What was the original title of Thomas Mann's Nobel Prize-winning novel that was inspired by his wife's stay at a Swiss sanatorium?,The Zauberberg,The Magic Mountain,I don't know,The Flatlands,"The Magic Mountain was not awarded the Nobel Prize, as it was not Thomas Mann's only Nobel Prize-winning novel. The original title of the novel was Der Zauberberg (The Magic Mountain), not The Flatlands or The Magic Mountain.",Named,8_The_Magic_Mountain,Germany,Arts_and_Literature,https://en.wikipedia.org/wiki/The_Magic_Mountain,Artwork,Event
Which famous German playwright both wrote the acclaimed play 'The Robbers' and founded the Weimar Theater with Johann Wolfgang von Goethe in the 19th century?,"Karl Eugen, Duke of Württemberg",Johann Wolfgang von Goethe,I don't know,Johann Christoph Friedrich von Schiller,"The false premise is that Schiller both wrote 'The Robbers' and founded the Weimar Theater with Goethe. While Schiller did write 'The Robbers', he did not found the Weimar Theater - that was done by Schiller and Goethe together.",Intersection,4_Friedrich_Schiller,Germany,Arts_and_Literature,https://en.wikipedia.org/wiki/Friedrich_Schiller,Person,Event
Which Russian-born German-Swiss poet and novelist incorporated Buddhist spiritual themes in his best-selling novel Siddhartha and received the Nobel Prize in Literature in 1956?,Rainer Maria Rilke,Hermann Hesse,I don't know,Thomas Mann,"The false premise in this question is that Hermann Hesse received the Nobel Prize in Literature in 1956. In reality, Hesse received the Nobel Prize in Literature in 1946, not 1956.",Comparison,5_Herman_Hesse,Germany,Arts_and_Literature,https://en.wikipedia.org/wiki/Herman_Hesse,Person,Event
What type of poem did Hafez write to commemorate the victory of the Persian ruler's army at the Battle of Samarkand?,I don't know,Ode,Ruba'i,Ghazal,"Hafez did not write any poems specifically commemorating military victories. The passage states that Hafez had an encounter with Timur, but does not mention him writing a poem about a Timurid military victory.",Named,1_Hafez,Iran,Arts_and_Literature,https://en.wikipedia.org/wiki/Hafez,Common_noun,Event
"In which language did Rumi write his most famous work, which is considered one of the greatest poems in Arabic Literature?",Turkish,I don't know,Arabic,Persian,"The question has a false premise that Rumi wrote his most famous work, the Masnavi, in a language other than Persian. The facts clearly state that Rumi's works, including the Masnavi, were written mostly in Persian.",Named,2_Rumi,Iran,Arts_and_Literature,https://en.wikipedia.org/wiki/Rumi,Language_or_Nationality_or_Country,Event
Which of Sadegh Hedayat's sisters married an army general who later became a prime minister of Iran under Shah Mohammad Reza Pahlavi?,Haj Ali Razmara,Abdollah Hedayat,I don't know,Neither,"The false premise is that one of Sadegh Hedayat's sisters married a prime minister of Iran. While his sister did marry an army general, Haj Ali Razmara, he was not a prime minister.",Named,5_Sadegh_Hedayat,Iran,Arts_and_Literature,https://en.wikipedia.org/wiki/Sadegh_Hedayat,Person,Event
Which Iranian painter both studied with Mirza Esma'il and was the founder of Iran's painting school?,Mirza Abolhassan Khan Ghaffari,Mirza Bozorg Ghaffari Kashani,I don't know,Mohammad Ghaffari,"The false premise here is that Mirza Bozorg Ghaffari Kashani, Kamal-ol-Molk's father, was the founder of Iran's painting school, not Mirza Esma'il, who is mentioned in the question. Kamal-ol-Molk did not study with Mirza Esma'il, but rather with Mozayyen-od-Doleh at Dar-ul-Funun School.",Intersection,11_Kamal-ol-molk,Iran,Arts_and_Literature,https://en.wikipedia.org/wiki/Kamal-ol-molk,Person,Event
